{"$defs":{"strings":{"items":{"minLength":1,"type":"string"},"minItems":1,"type":"array","uniqueItems":true}},"$id":"https://atlas-suite.local/schemas/proof-plan.schema.json","$schema":"https://json-schema.org/draft/2020-12/schema","additionalProperties":false,"properties":{"claim_ids":{"$ref":"#/$defs/strings"},"dimensions":{"$ref":"#/$defs/strings"},"falsifying_cases":{"$ref":"#/$defs/strings"},"fixtures":{"additionalProperties":false,"properties":{"boundary":{"$ref":"#/$defs/strings"},"negative":{"$ref":"#/$defs/strings"},"positive":{"$ref":"#/$defs/strings"}},"required":["positive","negative","boundary"],"type":"object"},"frozen_thresholds":{"additionalProperties":{"type":"number"},"minProperties":1,"type":"object"},"hypothesis":{"minLength":1,"type":"string"},"id":{"type":"string"},"independent_verification":{"minLength":1,"type":"string"},"profile_id":{"type":"string"},"proof_limits":{"$ref":"#/$defs/strings"},"schema":{"const":"atlas-proof-plan/1.0"}},"required":["schema","id","profile_id","claim_ids","hypothesis","dimensions","fixtures","falsifying_cases","frozen_thresholds","independent_verification","proof_limits"],"title":"Atlas falsifiable proof plan 1.0","type":"object"}
