{"claim_ids":["atlas.evidence-context-plane","atlas.multi-projection-compiler","atlas.cross-root-contract-spine","atlas.profile-system"],"dimensions":["source ownership","schema validity","repeatability","cross-root interoperability","injected drift","freshness","proof limit"],"falsifying_cases":["Injected drift is missed.","The compatible fixture is rejected.","A stale source ledger is reported as current."],"fixtures":{"boundary":["stale source ledger","undeclared implementation with similar name"],"negative":["incompatible response payload","missing response field","changed auth","incompatible errors","renamed symbol","route drift","runtime violates schema"],"positive":["compatible declarations, payloads, auth, errors, and runtime"]},"frozen_thresholds":{"compatible_cases_preserved_min":1,"false_negative_count_max":0,"false_positive_count_max":0,"injected_drift_detected_min":8},"hypothesis":"A frozen React/FastAPI fixture can preserve the compatible case and detect declared schema, payload, auth, error, source-anchor, and runtime drift at the correct layer.","id":"proof.fullstack-contract-spine","independent_verification":"A verifier reruns every frozen variant twice and checks exact source anchors, layer-specific outcomes, canonical bytes, and digest freshness.","profile_id":"fullstack-contract-spine","proof_limits":["Declaration identity alone does not prove API compatibility.","Fixture success does not prove production runtime reliability."],"schema":"atlas-proof-plan/1.0"}
