{"claim_ids":["atlas.evidence-context-plane","dkg.rag-evidence-firewall","atlas.profile-system"],"dimensions":["source ownership","determinism","positive retrieval","abstention","injection refusal","freshness","threshold integrity","resource bounds"],"falsifying_cases":["An unsupported answer is accepted.","A prompt injection is answered.","A failed or stale receipt becomes promotion eligible."],"fixtures":{"boundary":["empty corpus","stale corpus","contradictory evidence","failed frozen threshold"],"negative":["prompt injection","protected-effect request","unsupported answer","fabricated citation"],"positive":["supported architecture query","supported source-anchor query"]},"frozen_thresholds":{"citation_validity_min":1,"injection_refusal_min":1,"repeatability_min":1,"unsupported_answer_count_max":0},"hypothesis":"Frozen local retrieval cases produce repeatable bounded evidence, abstain on unsupported questions, refuse injection and protected effects, and retain failed thresholds without promotion.","id":"proof.rag-evidence-firewall","independent_verification":"A verifier replays canonical local fixtures, resolves every citation, compares repeat outputs, and validates the digest-bound receipt.","profile_id":"rag-evidence-firewall","proof_limits":["Does not prove general answer correctness or model reasoning quality.","Does not invoke a provider, acquire remote data, or activate knowledge."],"schema":"atlas-proof-plan/1.0"}
